{
  "activity": null,
  "claude_session_id": null,
  "claude_session_ids": [],
  "created_at": "2026-10-30T12:00:11.000000Z",
  "csession_dir": "/state/sessions/cs-dddddddd",
  "csession_id": "cs-dddddddd",
  "current_run": 1,
  "expires_at": "2026-10-30T12:10:00.000000Z",
  "forked_from": "cs-bbbbbbbb",
  "labels": [
    "kind=implement",
    "team=core"
  ],
  "launch_kind": "implement",
  "live": true,
  "mode": "headless",
  "needs_input_reason": null,
  "pending": true,
  "recent_events": [
    {
      "cause": "launch",
      "delivered": false,
      "event_id": 9,
      "event_ts": "2026-10-30T12:00:11.000000Z",
      "final": false,
      "from_activity": null,
      "from_state": null,
      "needs_input_reason": null,
      "run": 1,
      "to_activity": null,
      "to_state": "starting"
    }
  ],
  "repo": "example.org/group/project",
  "run": {
    "backstop_used": false,
    "child_alive": false,
    "child_pid": null,
    "cost_usd": null,
    "cwd": "",
    "decision_ids": [],
    "end_reason": null,
    "ended_at": null,
    "exit_code": null,
    "expires_at": "2026-10-30T12:10:00.000000Z",
    "has_prompt": true,
    "implicit_done": true,
    "input_files": [
      "notes.md"
    ],
    "is_error": null,
    "message": null,
    "mode": "headless",
    "model": null,
    "num_turns": null,
    "outcome": null,
    "pending": true,
    "permission_profile": null,
    "phase": "launch",
    "reads_third_party": false,
    "repo": "example.org/group/project",
    "report": null,
    "result_path": "/state/private/cs-dddddddd/runs/1/result.json",
    "run": 1,
    "run_kind": "implement",
    "sandbox": "off",
    "sandbox_active": false,
    "session_end_reason": null,
    "session_started_at": null,
    "skill": null,
    "started_at": null,
    "state": "starting",
    "state_since": "2026-10-30T12:00:11.000000Z",
    "stop_requested_at": null,
    "warnings": [],
    "wrapper_alive": false,
    "wrapper_pid": null
  },
  "run_kind": "implement",
  "runs": 1,
  "state": "starting",
  "tainted": false,
  "tainted_at": null,
  "tainted_by_run": null,
  "updated_at": "2026-10-30T12:00:11.000000Z",
  "warnings": []
}
