{
  "activity": null,
  "claude_session_id": "c0ffee00-0000-4000-8000-000000000001",
  "claude_session_ids": [
    {
      "claude_session_id": "c0ffee00-0000-4000-8000-000000000001",
      "run": 1,
      "seen_at": "2026-10-30T12:00:06.000000Z",
      "source": "startup",
      "transcript_path": "/home/u/.claude/projects/p/c0ffee.jsonl"
    }
  ],
  "created_at": "2026-10-30T12:00:04.000000Z",
  "csession_dir": "/state/sessions/cs-bbbbbbbb",
  "csession_id": "cs-bbbbbbbb",
  "current_run": 1,
  "expires_at": null,
  "forked_from": null,
  "labels": [
    "kind=review",
    "team=web"
  ],
  "launch_kind": "review",
  "live": false,
  "mode": "headless",
  "needs_input_reason": null,
  "pending": false,
  "recent_events": [
    {
      "cause": "launch",
      "delivered": false,
      "event_id": 3,
      "event_ts": "2026-10-30T12:00:04.000000Z",
      "final": false,
      "from_activity": null,
      "from_state": null,
      "needs_input_reason": null,
      "run": 1,
      "to_activity": null,
      "to_state": "starting"
    },
    {
      "cause": "SessionStart",
      "delivered": false,
      "event_id": 4,
      "event_ts": "2026-10-30T12:00:06.000000Z",
      "final": false,
      "from_activity": null,
      "from_state": "starting",
      "needs_input_reason": null,
      "run": 1,
      "to_activity": "working",
      "to_state": "working"
    },
    {
      "cause": "report",
      "delivered": false,
      "event_id": 5,
      "event_ts": "2026-10-30T12:00:07.000000Z",
      "final": false,
      "from_activity": "working",
      "from_state": "working",
      "needs_input_reason": null,
      "run": 1,
      "to_activity": "idle",
      "to_state": "reported"
    },
    {
      "cause": "exit",
      "delivered": false,
      "event_id": 6,
      "event_ts": "2026-10-30T12:00:08.000000Z",
      "final": true,
      "from_activity": "idle",
      "from_state": "reported",
      "needs_input_reason": null,
      "run": 1,
      "to_activity": null,
      "to_state": "exited"
    }
  ],
  "repo": "example.org/group/project",
  "run": {
    "backstop_used": false,
    "child_alive": false,
    "child_pid": 6161,
    "cost_usd": 0.125,
    "cwd": "/work/project",
    "decision_ids": [],
    "end_reason": "normal",
    "ended_at": "2026-10-30T12:00:08.000000Z",
    "exit_code": 0,
    "expires_at": null,
    "has_prompt": true,
    "implicit_done": true,
    "input_files": [
      "notes.md"
    ],
    "is_error": false,
    "message": null,
    "mode": "headless",
    "model": null,
    "num_turns": 3,
    "outcome": "done",
    "pending": false,
    "permission_profile": "default",
    "phase": "session",
    "reads_third_party": true,
    "repo": "example.org/group/project",
    "report": {
      "artifact": {
        "name": "result.md",
        "path": "/state/private/cs-bbbbbbbb/runs/1/artifact/1/result.md",
        "sha256": "abababababababababababababababababababababababababababababababab",
        "size": 12
      },
      "implicit": false,
      "reason": null,
      "reported_at": "2026-10-30T12:00:07.000000Z",
      "status": "done",
      "summary": "All tests pass."
    },
    "result_path": "/state/private/cs-bbbbbbbb/runs/1/result.json",
    "run": 1,
    "run_kind": "review",
    "sandbox": "off",
    "sandbox_active": false,
    "session_end_reason": null,
    "session_started_at": "2026-10-30T12:00:06.000000Z",
    "skill": null,
    "started_at": "2026-10-30T12:00:05.000000Z",
    "state": "exited",
    "state_since": "2026-10-30T12:00:08.000000Z",
    "stop_requested_at": null,
    "warnings": [],
    "wrapper_alive": false,
    "wrapper_pid": 4343
  },
  "run_kind": "review",
  "runs": 1,
  "state": "exited",
  "tainted": true,
  "tainted_at": "2026-10-30T12:00:04.000000Z",
  "tainted_by_run": 1,
  "updated_at": "2026-10-30T12:00:08.000000Z",
  "warnings": []
}
