{
  "activity": "working",
  "claude_session_id": "c0ffee00-0000-4000-8000-000000000001",
  "claude_session_ids": [
    {
      "claude_session_id": "c0ffee00-0000-4000-8000-000000000001",
      "run": 1,
      "seen_at": "2026-10-30T12:00:03.000000Z",
      "source": "startup",
      "transcript_path": "/home/u/.claude/projects/p/c0ffee.jsonl"
    }
  ],
  "created_at": "2026-10-30T12:00:01.000000Z",
  "csession_dir": "/state/sessions/cs-aaaaaaaa",
  "csession_id": "cs-aaaaaaaa",
  "current_run": 1,
  "expires_at": null,
  "forked_from": null,
  "labels": [
    "kind=implement",
    "prio=high",
    "team=core"
  ],
  "launch_kind": "implement",
  "live": true,
  "mode": "headless",
  "needs_input_reason": null,
  "pending": false,
  "recent_events": [
    {
      "cause": "launch",
      "delivered": false,
      "event_id": 1,
      "event_ts": "2026-10-30T12:00:01.000000Z",
      "final": false,
      "from_activity": null,
      "from_state": null,
      "needs_input_reason": null,
      "run": 1,
      "to_activity": null,
      "to_state": "starting"
    },
    {
      "cause": "SessionStart",
      "delivered": false,
      "event_id": 2,
      "event_ts": "2026-10-30T12:00:03.000000Z",
      "final": false,
      "from_activity": null,
      "from_state": "starting",
      "needs_input_reason": null,
      "run": 1,
      "to_activity": "working",
      "to_state": "working"
    }
  ],
  "repo": "example.org/group/project",
  "run": {
    "backstop_used": false,
    "child_alive": true,
    "child_pid": 5151,
    "cost_usd": null,
    "cwd": "/work/project",
    "decision_ids": [],
    "end_reason": null,
    "ended_at": null,
    "exit_code": null,
    "expires_at": null,
    "has_prompt": true,
    "implicit_done": true,
    "input_files": [
      "notes.md"
    ],
    "is_error": null,
    "message": null,
    "mode": "headless",
    "model": null,
    "num_turns": null,
    "outcome": null,
    "pending": false,
    "permission_profile": "default",
    "phase": "session",
    "reads_third_party": false,
    "repo": "example.org/group/project",
    "report": null,
    "result_path": "/state/private/cs-aaaaaaaa/runs/1/result.json",
    "run": 1,
    "run_kind": "implement",
    "sandbox": "off",
    "sandbox_active": false,
    "session_end_reason": null,
    "session_started_at": "2026-10-30T12:00:03.000000Z",
    "skill": null,
    "started_at": "2026-10-30T12:00:02.000000Z",
    "state": "working",
    "state_since": "2026-10-30T12:00:03.000000Z",
    "stop_requested_at": null,
    "warnings": [],
    "wrapper_alive": true,
    "wrapper_pid": 4242
  },
  "run_kind": "implement",
  "runs": 1,
  "state": "working",
  "tainted": false,
  "tainted_at": null,
  "tainted_by_run": null,
  "updated_at": "2026-10-30T12:00:03.000000Z",
  "warnings": []
}
